{
  "schema_version": "3.2-b.1",
  "run_id": "run-gold-0001",
  "task_id": "task-dog-0001",
  "condition": "GOLD_EVIDENCE",
  "agent_response": null,
  "selected_memory_ids": ["evidence-slot-1"],
  "retrieved_memory_ids": ["evidence-slot-1"],
  "reasoning_context_ref": "fixtures/gold_evidence/agent_visible_context.json",
  "execution_status": "SKIPPED",
  "timing": {
    "started_at": "2026-08-01T00:00:00Z",
    "completed_at": "2026-08-01T00:00:00Z",
    "duration_ms": 0
  },
  "trace_ref": "fixtures/gold_evidence/trace_artifact.json"
}
