{
  "schema_version": "3.2-b.1",
  "run_id": "run-retr-0001",
  "task_id": "task-dog-0001",
  "condition": "RETRIEVED_MEMORY",
  "agent_response": null,
  "selected_memory_ids": ["mem-a1", "mem-a7"],
  "retrieved_memory_ids": ["mem-a1", "mem-a7", "mem-b3"],
  "reasoning_context_ref": "fixtures/retrieved_memory/agent_visible_context.json",
  "execution_status": "SKIPPED",
  "timing": {
    "started_at": "2026-08-01T00:00:00Z",
    "completed_at": "2026-08-01T00:00:00Z",
    "duration_ms": 0
  },
  "trace_ref": "fixtures/retrieved_memory/trace_artifact.json"
}
